<xs:schema xmlns:xs="http://www.w3.org/2001/XMLSchema">
   

<xs:element name="productos">
        <xs:complexType>
            <xs:sequence>
                <xs:element name="producto" maxOccurs="unbounded">
                    <xs:complexType>
                        <xs:sequence>
                            <xs:element name="nombre" type="xs:string"/>
                            <xs:element name="tipo" type="xs:string"/>
                            <xs:element name="precio">
                                <xs:simpleType>
                                    <xs:restriction base="xs:int">
                                        <xs:minInclusive value="0"/>
                                    </xs:restriction>
                                </xs:simpleType>
                            </xs:element>
                            <xs:element name="stock" type="xs:int"/>
                        </xs:sequence>
                        <!-- Atributo opcional "fragil" -->
                        <xs:attribute name="fragil" type="xs:boolean" use="optional"/>
                    </xs:complexType>
                </xs:element>
            </xs:sequence>
        </xs:complexType>
    </xs:element>
</xs:schema>
